Phase/Feature,Type,Task,Min H,Max H
01 Init / Foundation,CTO/Arquitectura,Setup project architecture and Docker environment,4,6
01 Init / Foundation,Desarrollo Backend,Initialize Django project with multi-tenant structure,3,4
01 Init / Foundation,Desarrollo Frontend,Setup React project with TypeScript and UI component library,3,4
01 Init / Foundation,Dise単o UI/UX,Create wireframes and design system for Lead Magnet interface,6,8
01 Init / Foundation,CTO/Arquitectura,Configure MySQL database schema with tenant isolation,2,3
01 Init / Foundation,Desarrollo Backend,Setup Redis and Celery for background processing,2,3
01 Init / Foundation,Reuniones,Technical kickoff and architecture review session,1,2
02 User Authentication,Desarrollo Backend,Implement JWT authentication with role-based access control,4,6
02 User Authentication,Desarrollo Backend,Create multi-tenant user management system,3,5
02 User Authentication,Desarrollo Frontend,Build login/logout interface and protected routes,3,4
02 User Authentication,Desarrollo Backend,Implement agency and user invitation workflows,2,3
02 User Authentication,Testeo,Authentication and authorization testing,1,2
03 Lead Magnet Conversational Interface,Dise単o UI/UX,Design conversational interface layout and user flow,4,6
03 Lead Magnet Conversational Interface,Desarrollo Frontend,Build chat interface with message history and typing indicators,5,7
03 Lead Magnet Conversational Interface,Desarrollo Backend,Create conversation state management and persistence,4,6
03 Lead Magnet Conversational Interface,Desarrollo Backend,Implement dynamic question flow logic,3,5
03 Lead Magnet Conversational Interface,Prompting,Design conversation prompts for lead qualification in Spanish,3,4
03 Lead Magnet Conversational Interface,Desarrollo Backend,Integrate OpenAI API for natural language processing,3,4
03 Lead Magnet Conversational Interface,Testeo,Conversation flow and state management testing,2,3
04 AI Strategy Generation Engine,Prompting,Develop SERSEO methodology prompts for strategy generation,5,7
04 AI Strategy Generation Engine,Desarrollo Backend,Build strategy generation pipeline with OpenAI integration,4,6
04 AI Strategy Generation Engine,Desarrollo Backend,Create strategy template system for different sectors,3,5
04 AI Strategy Generation Engine,Desarrollo Frontend,Implement live strategy preview interface,4,6
04 AI Strategy Generation Engine,Desarrollo Backend,Add quality validation and coherence checking,2,3
04 AI Strategy Generation Engine,Testeo,Strategy generation quality and performance testing,2,3
05 Lead Management & Clientify Integration,Desarrollo Backend,Create lead data model and basic CRUD operations,2,3
05 Lead Management & Clientify Integration,Desarrollo Frontend,Build lead dashboard with filtering and search,4,6
05 Lead Management & Clientify Integration,Desarrollo Backend,Implement Clientify API integration with retry logic,4,6
05 Lead Management & Clientify Integration,Desarrollo Backend,Create sync status monitoring and error handling,2,3
05 Lead Management & Clientify Integration,Desarrollo Frontend,Add lead detail view with conversation history,3,4
05 Lead Management & Clientify Integration,Testeo,Lead management and integration testing,2,3
06 PDF Strategy Export,Desarrollo Backend,Setup PDF generation library and template engine,2,3
06 PDF Strategy Export,Dise単o UI/UX,Design professional PDF layout with branding elements,3,4
06 PDF Strategy Export,Desarrollo Backend,Implement dynamic PDF generation with strategy content,4,6
06 PDF Strategy Export,Desarrollo Backend,Add agency branding configuration system,2,3
06 PDF Strategy Export,Desarrollo Frontend,Create PDF download and sharing interface,2,3
06 PDF Strategy Export,Testeo,PDF generation performance and quality testing,1,2
07 RGPD Compliance & Data Protection,CTO/Arquitectura,Design RGPD-compliant data architecture,2,3
07 RGPD Compliance & Data Protection,Desarrollo Backend,Implement consent management and audit logging,3,5
07 RGPD Compliance & Data Protection,Desarrollo Frontend,Create consent forms and privacy policy integration,2,3
07 RGPD Compliance & Data Protection,Desarrollo Backend,Add data retention policies and cleanup automation,2,3
07 RGPD Compliance & Data Protection,Desarrollo Backend,Implement data export and deletion functionality,2,3
07 RGPD Compliance & Data Protection,Testeo,Compliance validation and audit trail testing,1,2
08 Mobile Responsiveness & UX Polish,Dise単o UI/UX,Optimize interface for tablet and mobile devices,3,4
08 Mobile Responsiveness & UX Polish,Desarrollo Frontend,Implement responsive design across all components,4,6
08 Mobile Responsiveness & UX Polish,Desarrollo Frontend,Add loading states and error handling improvements,2,3
08 Mobile Responsiveness & UX Polish,Testeo,Cross-device compatibility testing,2,3
99 Finalisation,Desarrollo Backend,Configure production environment and security headers,2,3
99 Finalisation,CTO/Arquitectura,Setup Docker Swarm deployment configuration,3,4
99 Finalisation,Testeo,End-to-end testing of complete user journeys,4,6
99 Finalisation,Testeo,Performance testing for concurrent conversations,2,3
99 Finalisation,CTO/Arquitectura,Deploy to IONOS VPS and configure monitoring,2,3
99 Finalisation,Reuniones,Final review and handoff session,1,2 